{
  "schema_version": "1.0",
  "benchmark_id": "aider-polyglot",
  "task_id": "javascript/bowling",
  "backend_id": "claude-code",
  "run_id": "run-001",
  "attempt": 1,
  "started_at": "2026-07-18T01:33:06Z",
  "finished_at": "2026-07-18T01:35:33Z",
  "isolation": {
    "tier": "worktree"
  },
  "backend_invocation": {
    "model": "sonnet",
    "temperature": 0.0,
    "seed": null
  },
  "prompt": {
    "path": "prompt.md",
    "sha256": "c867143c40da6700aaaca45b71c1b35d15f08434b4a8b182308f695cea0b0e9f"
  },
  "effective_prompt": null,
  "model_output_path": null,
  "backend": {
    "error": null,
    "metadata": {
      "family": "claude-code",
      "model": "sonnet",
      "claude_code_invocation": "launcher",
      "effort": null,
      "timeout_seconds": 600,
      "provider_endpoint": null,
      "anthropic_auth_token_present": false,
      "session_id": null,
      "exit_code": 0,
      "stderr_tail": ""
    }
  }
}